{
  "schema_version": "1.0.0",
  "schemas": {
    "game": "schemas/game.schema.json",
    "defect": "schemas/defect.schema.json",
    "session_log": "schemas/session-log.schema.json"
  },
  "games": [
    "catalog/games/00_00.json",
    "catalog/games/00_01.json",
    "catalog/games/00_05.json",
    "catalog/games/00_06.json",
    "catalog/games/00_07.json",
    "catalog/games/00_08.json",
    "catalog/games/00_09.json"
  ],
  "defects": [
    "catalog/defects/00_00-D01.json",
    "catalog/defects/00_01-D01.json",
    "catalog/defects/00_05-D01.json",
    "catalog/defects/00_06-D01.json",
    "catalog/defects/00_07-D01.json",
    "catalog/defects/00_08-D01.json",
    "catalog/defects/00_09-D01.json"
  ],
  "log_examples": [
    "catalog/examples/session-log.json"
  ]
}
